cluster,size,keywords,rep_titles,intra_sim_mean,inter_sim_max,separation_margin,keyword_npmi,keyword_diversity,growth,engagement,salience,policy_relevance,relevance_n,salience_n,final_rank_score
29,26,"가명처리에, 제37조, 법익, 2024다210554, 기록보존, 정당행위에, 정보주체, 제20조, 세대주, 584장, 동대표, 사회상규에, 달성에, 입주자카드, 비실명화","['가명처리에 대한 처리정지 요구권 인정여부', '당원 등록 시 개인 정보 보안', 'CISO 정보보호최고책임자 지정.전자금융거래법? 정보통신망 이용촉진 및 정보보호 등에 관한 법률?', '개인정보파일 등록 및 공개', '<수리할 권리> 강의와 체험', '미 법원, ""메타, 여성 건강 앱 민감정보 불법 수집했다"".개인정보보호법 위반 인정', '정보통신망 이용촉진 및 정보보호 등에 관한 법률 약칭: 정보통신망 이용촉진 및 정보보호 등에 관한 법률 시행 2025. 7. 22. 법률 제20678호, 2025. 1. 21., 일부개정 방송통신위원회']",0.6350428462028503,0.8297356367111206,-0.19469279050827026,0.507148878318101,1.0,1.0,0.0,0.4303091908696249,0.6214420199394226,0.9459544949503906,0.9394529276218011,0.941403397820378
37,30,"직계, 채용서류, 모집요강, 소정근로시간, 제4조의3, 전철역, 180일까지, 우편발송, 이력서, 혼인여부, 복리후생, 고용촉진에, 근무형태, 법률시행령, 불합격자","['광주광역 2025학년도 2학기 학생생활부장 수업지원 한국어강사 채용 공고 2025.8.11.16:30 까지', '레메디 장외주식 최근동향.', '2025 제52회 고창 모양성제 청소년 댄스 페스티벌 참가자 모집 2025년 11월 1일 토요일 14:00~16:00 고창읍성 잔디광장 특설무대', '2025 광주 ACE Fair 사전등록 무료입장 신청하기', '중앙대학교의료원 광명병원 보험심사팀 행정직 간호사 모집 2025.08', '광복절 80주년 기념 행사 빛의 동행단 신청 7일 오늘 자정까지!', '김해문화관광재단 김해문화의전당 단시간 노동자 공연장 안내요원 채용 공고. 2026년 축산물위생 및 스마트 HACCP 관련 사업 수요조사 공고']",0.7667312622070312,0.9651565551757812,-0.19842529296875,0.32264294544061495,1.0,1.0,0.0,0.45375397186845096,0.38248375058174133,0.16461332713310162,1.0,0.7493839981399304
10,25,"가령, 리딩서비스, vii, 동사무소, 가족관계증명서, 250, iii, 비율, 25세, 서류별, 공시송달, 주식리딩, 도표, 기대수익, 1건","['변호사 선임서에 이름', '오픈채팅에서 자살 암시 발언, 위치 추적 및 신고 시 대처 방법', 'hphp77 사기사건 투자금 손실 주의 및 피해자 사칭 경계', '발로란트 게임 내에서의 언쟁, 과연 법적 문제가 될까요?', '인터넷 불법 모니터링 피해와 징벌적 손해배상 청구: 주식 리딩서비스 피해자라면 어떻게 보상받을 수 있나?', '성인 자녀의 보험, 부모님이 조회 가능한가? 22세 성인의 보험정보 보호와 예외 상황 총정리', '군대 현역 복무 사실 증명서, 언제 왜 필요할까? 이혼 별거 가정에서의 활용 사례까지']",0.5760904550552368,0.826275646686554,-0.25018519163131714,0.22750787191534821,1.0,1.0,0.0,0.35075514211564196,0.5614349842071533,0.7497446399730578,0.7340014564339341,0.7387244114956713
18,19,"녹음하면, 제도명, 신청하려, pixabay, 거리에서, 찍혔, 불법일까, 퍼졌습니다, 합법이지, 카메라등이용촬영죄, 전자기기, 자유에, 기록열람복사, 간단해, 살아갑니다","['사적 녹음 후 공표 시 명예훼손 여부 판단', '공공장소 촬영 주의사항부터 기록 열람복사, 다툼 중 손이 닿은 경우까지 완벽 정리!', '국회 본회의장 스마트폰 잔혹사: 켜지는 순간, 드러나는 정치권의 민낯', '전주 녹취록 전문 1급 속기사 전주속기사무소', '엘리베이터 개인 촬영 불법일까 검증', '홈캠몰카 카촬죄 불법촬영 걸리면? 처벌과 피의자의 대응법', '통신비밀보호법 - 무심코 한 녹음이 범죄가 되는 순간']",0.6178825497627258,0.782351553440094,-0.16446900367736816,0.4071084321389131,1.0,1.0,0.0,0.3171341393053085,0.5916345119476318,0.8484904767909356,0.6471738895359187,0.7075688657124237
57,22,"트러스트, 사이버안전, 랜섬웨어, trust, 공격, 사용자별, 트랜잭션, 차단하여, 작동하도록, privilege, 2fa, 코리아it아카데미, 하드디스크, 정기적인, 전국7개","['개인정보 보호와 사이버 보안, 디지털 시대의 필수 과제', '샤크라맥스, 통합 접근제어 솔루션 출시', '랜섬웨어 예방을 위해 백업은 선택이 아닌 필수', '보성군청 정보보안! 하드디스크 파쇄 현장 전격 공개', '보안 정책이란? 활용 사례부터 유의사항, 실전 팁까지 쉽게 정리', '정보보안의 중요성', '사이버복원력법 CRA , NIST SSDF, 제품보안']",0.5226039290428162,0.8388810157775879,-0.31627708673477173,0.45328452353544774,1.0,1.0,0.0,0.33255166231523187,0.5548056364059448,0.7280681256310915,0.6869902512934083,0.6993136135947132
