cluster,size,keywords,rep_titles,intra_sim_mean,inter_sim_max,separation_margin,keyword_npmi,keyword_diversity,growth,engagement,salience,policy_relevance,relevance_n,salience_n,final_rank_score
33,26,"관련한, 기업전문컨설팅, 단체상해보험, 기업체, one시너지컨설팅, 25년, 서울상담심리대학원대학교, 하서출판사, 대한산업안전협회, 정보제공, 네이버, 규칙, 2012, 신속하게, 개정판","['산업안전보건기준에 관한 규칙_ 제91조 고장난 기계의 정비 등 296', '논슬립 코팅 업체 안전하게', '배달노동자 라이더 의 산재 가입과 인정 기준 등', '건설안전기술사 기출문제 130회 1교시 10. 기계ᆞ설비 장치의 잠금 및 표지부착 LOTO; Lock Out Tag Out', '동원F&B 안전, 환경 각각 채용 ~8/24', '산업안전보건기준에 관한 규칙_ 제84조 공기의 부피와 환기 289', '산업안전보건기준에 관한 규칙_ 제81조 수명장소 등의 설치 286']",0.6939182281494141,0.8764587640762329,-0.18254053592681885,0.7297141781236458,1.0,24.0,0.0,0.6981453049630529,0.8477944135665894,1.0,1.0,1.0
23,28,"방지용, 6층, 의정부건설사고, 추락해, 44개, dl건설, 13위, 사흘, 외벽에, 그물망, 투자한, 제거하려다, 지지대, e편한세상, 불가피해","['또 건설현장 사망사고. 대통령 직보 지시, 진짜 안전을 위한 걸까?', 'DL건설이란? 디엘건설은 무엇일까', 'DL건설 임원진 전원 사표로, GTX공사와 업무용 부동산 시장에 미칠 영향은?', ""DL건설, 중대재해 리스크에 수주 활동 '적신호'"", ""건설현장 '중대재해'.이제 CEO 자리까지 흔든다"", '250812 오늘의 산업 노동 현장 안전 사건/사고 총정리 Part 1', '50대, 의정부 아파트 공사 현장에서 추락: 중대재해처벌법은 어디에?']",0.7024930119514465,0.8914752006530762,-0.18898218870162964,0.35959454149181225,1.0,26.0,0.0,0.6909972410023686,0.6389478445053101,0.6735862195869518,0.9885071874070274,0.8940308970610046
19,26,"인증서, 안전보건경영시스템비용, iso45001, she계획서작성컨설팅, 130만원, 국제표준화기구, 대비이며, 환경경영시스템, 담당자명함, 위험성평가표작성, 품질경영시스템, email, 준비서류, 한전입찰iso45001인증비용, 45001","['한전입찰시 필수인 ISO45001인증서 안전보건경영시스템 비용과 기간', '지하주차장 곰팡이 제거 중대재해처벌법 시대, ISO 45001 인증이 왜 중요한가?', 'SH 평가 협력사 등록 통과를 위한 실전 가이드 | 기업인증원', 'ISO45001국제심사원교육 내용 소개, 한국기술융합연구소 KTCR', 'ISO 45001 인증 받으면 뭐가 달라질까?', '부자되는상식 중대재해처벌법과 ISO 45001 인증으로의 대응 전략', 'ISO 45001. 심사원 교육']",0.6767972111701965,0.8244985342025757,-0.14770132303237915,0.1662977478380136,1.0,11.0,0.0,0.4937431820060328,0.7536095380783081,0.8527950858659235,0.6713578242064483,0.7257890027042908
34,27,"시행일, 변호인, 사업주책임, 처벌수준, 청구권자, 기소했습니다, 사망사고와, 댓가, 평가서, 재산인거지요, 불특정, 16명, 재범, 2심, 두성산업","['중대재해처벌법', '""종료된 녹음 들은 건 \'청취\' 아니다"". 통신비밀보호법 해석 기준 제시 2023도8603', ""성경이 말하는 '중대재해처벌법'"", '성범죄자 신상정보 ""등록 공개 고지"", 무엇이 다를까?', '구속 적부심이란?', '중대재해처벌법 조언 사실을', '중대재해 발생 시 하청이 유죄더라도 원청이 무죄가 될 수 있음을 명확히 보여준 사례']",0.5682019591331482,0.9611659646034241,-0.3929640054702759,0.40074517791986086,1.0,11.5,0.0,0.48903658796547617,0.7195236682891846,0.7995210595482101,0.663790460014293,0.704509639874468
9,28,"지원자, 안전혁신경진대회, 채용검진, 수도권매립지관리공사, 견학, 근무지, 진행됩니다, 저감방안, 간담회에서, 모색했다, 아카데미, 개정사항, 본관, 부서장, 협력체계","['2025년 산업안전지도사 2차 합격자발표 3차면접일정/3차면접합격수기/3차면접학원/서울기술사학원', '매립지공사-협력업체. 산업재해예방 논의', ""호서대, '글로벌 혁신리더 비전스쿨' 성료.CEO 리더십 역량 강화"", '조합원사 맞춤 연수 여는 K-FINCO 기술교육원', '보건관리자 채용 호텔롯데 롯데호텔본사 보건관리담당 채용', '노무법인 벗 노무 자문 상담전 check list', '셀트리온 Celltrion 채용 신입/경력, 산업안전관리']",0.5742846131324768,0.8238868117332458,-0.24960219860076904,0.4870147369491125,1.0,2.0,0.0,0.46159947522277495,0.6729981899261475,0.7268047235975419,0.6196764738246763,0.6518149487565359
