cluster,size,keywords,rep_titles,intra_sim_mean,inter_sim_max,separation_margin,keyword_npmi,keyword_diversity,growth,engagement,salience,policy_relevance,relevance_n,salience_n,final_rank_score
13,14,"겁니다, 아동보호전문기관, 정서적학대, 보도, 본청, 통보, 통념, 직무, 13명, 65억, 원장에, 알림, 상세, 일종, 목격하게","['""아동 학대 후 정상 운영"" .피해 가족, 대책 마련 촉구 수원의 한 어린이집에서 아동 학대 사건이 발생하면서 가해 교사와 원장이 경찰 수사를 받고 최근 사건이 경찰에 송치됐는데요. 그런데 해당 학대 사건과 관련해 ', ""이게 진짜 나라냐고? 진실은 이겁니다. 아동 사망사건 '비밀누설 금지' 조항은 유족과 피해자 개인정보 보호를 위한 겁니다. 조사 과정에서 알게 된 민감한 정보 가정사, 의료정보, 아이 신원 를 아무나 퍼뜨리면 2차 "", '""싸가지 없는 XX"". 교사의 혼잣말, 아동학대일까요? 대법원은 ""부적절하지만, 아동학대는 아니다""라고 판단했습니다. 1 2심과는 완전히 다른 결론. 여러분 생각은 어떤가요? 대법원판결 교사욕설 아동학대논란 교육현장', '지난 주였나, 더 이전이였나, 65억 집을 7세 자녀에게 사주고 이게 기업 공개를 위한 조처였다고 한 부모들을 아동복지법 위반으로 고발한 건이, 사건 접수가 됐다고 카톡이 왔네요. 경찰청 친구추가를 하면 이렇게 사건', '아동복지법 공무집행방해 초등생협박 청소년성보호법 청소년성범죄 아동성범죄 자세한 내용은 스토리에서 확인', '앞서 언급한 내용을 확인 차 다시 포스팅을 합니다. 방금 카톡으로 각하 결정을 알린 아동복지법 위반 사건은 경찰청 본청에서 수사한 후 각하 의견으로 검찰에 송부하였고, 검찰은 앞서 언급했듯 사건을 받자마자 4일 만에', '아동학대? 많이 들어봤지만 아이 앞에서 싸우는 것도 아동학대일까? 난 때린적도 없는데? 이런 생각, 해보신 적 있으신가요? 학대유형 주사위를 던져 아동학대 유형을 알아봐요! 아동학대는 신체학대, 정서학대, 성학대, ']",0.6295477747917175,0.7893950343132019,-0.15984725952148438,0.3150767098035659,1.0,1.0,0.0,0.42141914998117763,0.816537082195282,1.0,0.7735351415099625,0.8414745990569736
19,38,"가세연, 김새론, 강남구, union, 조작된, 배우, 교제, 120억, 범죄적, 채널, fan, 녹취, global, 팔로우, 증명해낼","['- 전북지부와 연대합니다. ---------------------------------------- 전주 M초 악성민원인 엄벌촉구 탄원! 전교조 전북지부장이었던 송욱진 선생님은 현 전교조 전북지부 부지부장 자원하여 ', '<4월 청소년 아웃리치 지원사업 전달식> 전국적으로 봄꽃이 만개한 4월 11일. 청소년행복재단은 협력기관인 로뎀청소년학교와 사)청소년이 미래다의 활동을 응원하고자 오뚜기와 CJ로부터 후원받은 식료품으로 4월 아웃리치', '故김새론 유족, 김수현 아동복지법 위반 무고 혐의 고소 = 고 김새론 유족 측이 7일 오전 서울경찰청에 배우 김수현을 아동복지법 위반 혐의 등으로 고소했다. 유족 측 법무 대리인 부지석 변호사는 이날 서울 강남구 스', 'TRUTH IS SOOHYUN westandwithkimsoohyun KimSooHyunEffect 김수현 KimSooHyun 김수현화이팅 김수현_함께할게 김수현무죄 넉오프 디즈니플러스 김수현이 증명해낼 진실을 믿고', '과연 진실은!? 상담은 대한민국 형사전문 로펌에스 에서 유튜브 채널 로펌에스 검색 재미있게 알아가는 법률지식은 팔로우 하트 / 댓글 / 저장 친구에게 법률꿀팁 공유 법률조력이 필요하신 상황이라면 프로필 링크 형사사건', '청소년캠핑 참가자 모집 홍보안내 1박2일 글램핑 무료 김포시청소년수련원 청소년운영위원회 청소년들과 함께할 관내 중고등 청소년 15명을 모집합니다 ! 모집 1순위 : 다문화청소년 혹은 사회배려계층 청소년 * 해당 시 ', '오우~ 아는형님 두번째 출연 어린이날특집 진짜 어린이들이 왔다~! 인솔자 놉 보호자도 놉 대한민국의 아동복지법 제3조 1항에 아동은 만 18세 미만인 사람을 말한다고 규정 만 17세까지를 어린이로 본다고 한다~ 그렇']",0.5793898701667786,0.7725110054016113,-0.19312113523483276,0.2142896725619261,1.0,0.0,0.0,0.5229824355359994,0.5478975176811218,0.37400640365677207,0.9999999999999999,0.8122019210970315
18,16,"상시, 교육가족지원, 돌봄센터, 위탁가정, 제도개선, 지원체계, 보호양육, 보건복지부, 전문가정위탁, 자립준비청년, 돌봄, 재정, 속초시청, 가정에, 사업기간","['제가 대표발의한 아동복지법 개정안이 국회 본회의를 최종 통과했습니다 보호종료아동은 만 18세 이후 홀로 사회에 나서야 하지만, 충분한 준비 없이 자립해야 하는 현실 속에서 많은 어려움을 겪어왔습니다. 이에 저는 보호', '이상일 용인특례시장, 복지제도 개선 위해 보건복지부에 직접 건의 요양보호사 장기근속장려금 인상 돌봄센터 설치 기준 완화 등 현장 중심 제도개선 제안 광교저널 경기.용인/ 이상일 용인특례시장이 복지현장의 목소리를 담아', ""대구남구다함께돌봄센터, 아동 돌봄 서비스 프로그램 대구에서 '으뜸' 운영 - 문화체육관광부 주최, 2025 문화예술교육지원사업 '예술누림' 추진 중 - 돌봄 인프라 확충 계획, 장애아동 맞춤형 서비스 등 돌봄 사각지"", '- 용산구 아동참여기구 - 용산 I-소리모아단 위원 모집 안내 아동이 자신에게 영향을 미칠 수 있는 사항에 대해 관찰하고 자유롭게 의견을 표현하며, 관심분야에 대한 문제점과 해결방안을 제안하고 정책결정 과정에 참여할', '유엔아동권리협약 UNCRC 은 1989년 11월 20일 유엔총회에서 만장일치로 채택된 국제협약으로, 18세 미만 아동의 생존 보호 발달 참여 권리를 보장합니다. 현재 196개국이 비준했으며, 대한민국은 1991년 1', '2025여울돌가족 선정 : 희귀질환 아동 의료비 지원사업 공고 ᆞᆞᆞ 현재 의료 기술로는 완치가 안되는 희귀질환의 특징을 감안해 여울돌은 일회적 지원이 아닌 선정된 아동이 만 18세가 될 때까지 아동복지법, 청소년보', '""아동의 놀 권리 우선 조례""를 발의합니다. ""죄송합니다, 오늘은 조금만 놀게요."" 언젠가부터 서울 학교에서 아이들의 운동회가 줄고, 놀이터가 폐쇄됩니다. 아이들이 운동회를 하기 전 어른들에게 사과를 하고 허락을 구']",0.5882166624069214,0.8004451394081116,-0.21222847700119019,0.48355737175895175,1.0,0.0,0.0,0.35704228163836366,0.8152596950531006,0.997023386437873,0.6299882062208552,0.7400987602859606
15,11,"경적, 경찰서에, 차에, 데려간, 뻔했다, 가자, 김용신, 태워, 지난해, 위험하게, 무단횡단, 멈춰, 도로, 800만원, 후진해","['킥보드를 위험하게 탄다는 이유로 초등학생을 경찰서로 데려간 50대 운전자가 아동학대 혐의로 벌금형을 선고받았다. 운전자는 ""훈육 차원""이라고 항변했으나, 법원은 이를 받아들이지 않았다. 27일 법원에 따르면 광주지법', '""업어치기를 못 한다고?"" 중등 유도 대표선수 뺨 때린 부산시유도회 회장. 결국 벌금형 믿기 힘든 일이 또 일어났습니다. 부산에서 15세 유도 대표선수가 자신의 기술 구사가 미흡하다는 이유로 회장에게 얼굴을 수차례 ', '수영강습을 받는 9살 초등학생을 괴롭히고 화가 난 아이의 모습을 찍어 조롱한 강사에게 벌금형이 선고됐습니다. 울산지방법원은 아동복지법 위반 혐의로 재판에 넘겨진 20대 A씨에게 벌금 700만 원을 선고하고 아동학대 ', '아동학대 혐의로 처벌받은 손흥민의 부친 손웅정 SON축구아카데미 감독과 손흥민의 형인 손흥윤 수석코치가 체육단체로부터 각각 3개월과 6개월의 출전 정지 처분을 받았습니다. 21일 연합뉴스에 따르면 강원특별자치도축구협', '전동 킥보드로 중앙선을 넘던 학생을 차에 태워 경찰서로 데려간 운전자가 아동학대 혐의로 재판에 넘겨졌습니다. 광주지방법원 형사8단독은 11일 아동복지법 위반 아동학대 혐의를 받는 50대 운전자 A 씨의 첫 재판을 진', '초등생 자녀 앞에서 아내 폭행한 아버지 벌금형 초등학생인 자녀 앞에서 아내를 폭행하고 욕설한 아버지에게 법원이 벌금형을 선고했습니다. 울산지법은 아동복지법 위반 등의 혐의로 기소된 30대 A씨에게 벌금 500만 원을', '킥보드 무단횡단 학생, 경찰서로 데려간 운전자.아동학대 처벌? = 전통 킥보드를 위험하게 운전했다는 이유로 학생을 경찰서로 데려간 운전자가 아동학대로 처벌될 위기에 처했다. 광주지법 형사8단독 김용신 부장판사는 11']",0.741478681564331,0.9125993251800537,-0.17112064361572266,0.4654833701218529,1.0,1.0,0.0,0.4302053006199716,0.6224148273468018,0.5476493246159524,0.7931264175327591,0.719483289657717
12,8,"성립한다, 의제강간, 혐의뿐, 목격자, 16세, 의뢰인, 성인과, 번호, 판결, 살해예고, 대가, 최후변론서, 예고글, 오엔성공사례, 존재한다면","['오엔성공사례 case.012 미성년자 대상, 음란 메시지 처벌은? 초등학생인 줄 알면서 음란한 메시지를 보낸 의뢰인은 아동복지법 위반 혐의로 형사재판에 넘겨졌습니다. 과거 촬영된 영상까지 발각되며 실형 가능성도 커졌', ""아청법위반 1심 무죄 이후, 검사의 항소 및 '아동복지법위반 성적 학대행위 예비적 공소사실 추가.' 결과는 검사 항소기각 및 예비적 공소사실도 무죄! 항소심까지 진행하면서 검사님 참 이렇게까지 하셔야 하나 원망스럽기"", ""소아 성도착은 범죄다. 의제강간 연령 만 19세로 상향하고 아동 성학대 수사 및 처벌 강화하라! 지난 31일, 국회 전자청원 홈페이지에 '미성년자 의제강간 연령 상향 및 처벌 강화 법안', 이른바 '김수현 방지법' "", ""초등생에 집착해 협박 음란물까지. '살해 예고'한 20대 구속 송치 인터넷 커뮤니티에 초등학생 살해 예고글을 게시하고 아동 음란물을 배포한 혐의를 받는 20대 남성이 구속 상태로 검찰에 송치됐다. 지난 23일 서울 "", 'A씨는 자신의 집 근처에서 가방으로 하체를 가린 채 성기를 노출하는 행동을 하다가 우연히 그 모습을 목격한 아이들의 신고로 경찰 조사를 받게 됐다. 문제는 목격자가 모두 미성년자였다는 점이다. 단순 공연 음란 혐의뿐', '변호사의삶 8 구속영장기각 집으로 보내드립니다 <2편> 남중구 대표변호사님의 미성년자의제강간 사건에 대한 구속영장이 기각되었습니다. 구속영장 청구서에는 의뢰인이 채팅앱을 통해 만난 13세 이상 16세 미만의 미성년자', '<아청법 위반 집행유예 사례> 성범죄는 엄중한 처벌로 다루어지고 있으며 그중에서도 아동 관련 성범죄는 더욱 무거운 처벌이 내려집니다. 해당 사건은 미성년자 의제강간, 아동복지법 위반으로 의뢰인께서는 심각한 위기에 처']",0.6429524421691895,0.7710177898406982,-0.1280653476715088,0.17884401697558835,1.0,1.0,0.0,0.322374870931226,0.697574257850647,0.7227885386974695,0.5526871400223797,0.6037175596249066
