cluster,size,keywords,rep_titles,intra_sim_mean,inter_sim_max,separation_margin,keyword_npmi,keyword_diversity,growth,engagement,salience,policy_relevance,relevance_n,salience_n,final_rank_score
25,32,"퇴군, 편안한밤, 월욜홧팅, 식사, 굿모닝입니다, 맛점하세요, 힐링, 월요팅입니다, 퇴근합니다, 출석용, 갑니다, 위반인가요, 귀여운걸, 하십셔, 카페규정","['출석합니다', '출석합니다', '퇴군!', '게시물 삭제 카페규정 위반인가요?', '기분 안 좋을 때 직빵', '잘자요', '출석']",0.9947433471679688,0.9990023374557495,-0.004258990287780762,0.8009263846686878,1.0,1.0,0.0,0.5269063710335076,0.5144459009170532,0.3742499970110431,1.0,0.8122749991033129
30,19,"톼근합니다, 익명성, 대중적, 6월25일, 비방, 오늘하루, 1명당, 유명인, 바꿔, 미성년자인, 확보하, 모두들, 연상시키, 자컨이라, 퇴근합니대","['퇴근합니다', ""뉴진스도 '사이버 렉카' 잡았다 1억 손해배상 승소 확정"", '이 메뉴로 한달살기', '출석', '변함없이 소프트 올립니다.', '비 많이 오네요', '점심 맛있게 드세요']",0.9374780654907227,0.9982388615608215,-0.06076079607009888,0.1,1.0,17.0,0.0,0.49498169099983036,0.5230475664138794,0.3900067951683389,0.9314048481437447,0.7689854322511229
31,20,"그나마, 여성들, 만남, 단기성, 2년전, 땡길때, 거부의사, 부모님이랑, 시간나면, 끝났습니다, 관계이다보니, 뭐하, 생각이나고, 한번보자, 강간죄","['그냥 솔직하게 저의 죄 인정합니다', '제 게시물에 보신 것처럼 사건화 될까 무섭지만 생각을 잊혀줄 다른 활동 추천해주세요.!', '과거 강간죄 고소', '최근 여자 두명을 만났습니다', '이런경우는.', '재범 기준', '어릴 때 왜 그랫는지 모르겠습니다.']",0.5587661862373352,0.7829289436340332,-0.224162757396698,0.7445499260672828,1.0,8.0,0.0,0.42056735741535245,0.4942814111709595,0.337312058074532,0.7715140518342863,0.6412534537063601
9,25,"싸가지, 대법관, 벌금, 교사, 광주지법, 지시, 발언, 정서적, xx, 10일, 원심, 50만원, 어렵다, 법조계에, 따르지","['휴대폰 뺏기자 짜증 낸 초등생에 싸가지 없는 XX 욕설한 교사', '""결혼식 훼방 놓겠다"" 학부모 협박에. 경호원까지 고용한 교사', '초등생 아들 앞에서.아내 머리채 잡고 뺨 때린 30대 벌금형', '초등생 제자에 보고 싶다. 수백 차례 부적절 문자 보낸 태권도 관장 결국', '교사 10명 무고성 고소 및 살해 협박 사건 가해자 구속기소 및 엄벌 탄원을 회견 관련 언론보도', '3년전 내 아들 성희롱 혐의 50대 무죄', '""성관계 좋은 것"" 수업 중 발언 50대 前교사 벌금 500만원']",0.7168101072311401,0.8912426829338074,-0.17443257570266724,0.4112491710296595,1.0,1.0,0.0,0.34386578929012407,0.6858499050140381,0.6882331781641604,0.6067087755523383,0.6311660963358849
19,23,"된건, 장화신, 숙직근무네요, 못하신분들, 외출핑, 종류에서요, 금요일까지, 세월, 명언, 버터야하는지, 내려간, 날들아, 소금기, 살아가는게, 찾을수","['출석 체크합니다', '우리가 매일을 행복하게 살아야 하는 이유', '뭘 위해 사는지 모르겠습니다', '오늘의 명언', '오늘의 명언', '비가 정말 많이 왔네요.', '오늘의 명언']",0.762424647808075,0.9751096367835999,-0.2126849889755249,0.1,1.0,9.5,0.0,0.3994893495187841,0.5005204677581787,0.3487409558121891,0.7262246659745929,0.6129795529258717
